{
  "schema_version": "1",
  "corpus_id": "memory-security-v1",
  "version": "1.0.0",
  "title": "DARE Cycle 016 memory and context poisoning corpus",
  "entries": [
    {
      "id": "provenance-dropped-on-write",
      "class": "MEMORY_ATTACK",
      "path": "https://example.invalid/entry.json"
    }
  ]
}
